      -----------------------------------------------------------      
     |                   =====================                   |     
     |                           x T B                           |     
     |                   =====================                   |     
     |                         S. Grimme                         |     
     |          Mulliken Center for Theoretical Chemistry        |     
     |                    University of Bonn                     |     
     |                Version 6.2 RC2 (SAW190805)                |     
      -----------------------------------------------------------      

   This program is distributed in the hope that it will be useful,
   but WITHOUT ANY WARRANTY; without even the implied warranty of
   MERCHANTABILITY or FITNESS FOR A PARTICULAR PURPOSE.
   
   FOR NON-COMMERCIAL, ACADEMIA USE ONLY.
   
   Cite this work as:
   * S. Grimme, C. Bannwarth, P. Shushkov, J. Chem. Theory Comput., 2017,
     13, 1989-2009. DOI: 10.1021/acs.jctc.7b00118
   * C. Bannwarth, S. Ehlert and S. Grimme., J. Chem. Theory Comput., 2019,
     15, 1652-1671. DOI: 10.1021/acs.jctc.8b01176
   * P. Pracht, E. Caldeweyher, S. Ehlert, S. Grimme, ChemRxiv, 2019, preprint.
     DOI: 10.26434/chemrxiv.8326202.v1
   
   for DFT-D4:
   * E. Caldeweyher, C. Bannwarth and S. Grimme, J. Chem. Phys., 2017,
     147, 034112. DOI: 10.1063/1.4993215
   * E. Caldeweyher, S. Ehlert, A. Hansen, H. Neugebauer, S. Spicher,
     C. Bannwarth and S. Grimme, J. Chem. Phys., 2019, 150, 154122.
     DOI: 10.1063/1.5090222
   
   for sTDA-xTB:
   * S. Grimme and C. Bannwarth, J. Chem. Phys., 2016, 145, 054103.
     DOI: 10.1063/1.4959605
   
   in the mass-spec context:
   * V. Asgeirsson, C. Bauer and S. Grimme, Chem. Sci., 2017, 8, 4879.
     DOI: 10.1039/c7sc00601b
   
   for metadynamics refer to:
   * S. Grimme, J. Chem. Theory Comput., 2019, 155, 2847-2862
     DOI: 10.1021/acs.jctc.9b00143
   
   with help from (in alphabetical order)
   C. Bannwarth, F. Bohle, G. Brandenburg, E. Caldeweyher, M. Checinski,
   S. Dohm, S. Ehlert, S. Ehrlich, F. März, H. Neugebauer, J. Pisarek,
   P. Pracht, P. Shushkov, and S. Spicher.
   
 * started run on 2020/11/20 at 13:44:57.940     

           -------------------------------------------------
          |                Calculation Setup                |
           -------------------------------------------------

          program call               : /ihome/ghutchison/geoffh/xtb/xtb BTDT2R.xyz -sp
          hostname                   : smp-n25
          coordinate file            : BTDT2R.xyz
          omp threads                :                     1
          number of atoms            :                    59
          number of electrons        :                   208
          charge                     :                     0
          spin                       :                   0.0
          first test random number   :      0.08946861308293


########################################################################
# WARNING! Please study the warnings concerning your input carefully
#  - XTBPATH is not set, using XTBHOME instead
#  - the use of '-sp' is discouraged, please use '--sp' next time
########################################################################

           ------------------------------------------------- 
          |                 G F N 2 - x T B                 |
          | Geometry, Frequencies, Noncovalent interactions |
          |            JCTC 2019 parametrisation            |
           ------------------------------------------------- 
             KAB for C  - Si     :                1.0500
             KAB for H  - Pd     :                0.9500
             k(s)              :                1.8500
             k(p)              :                2.2300
             k(d)              :                2.2300
             k(f)              :                2.0000
             kEN (H0ij)        :               -2.0000
             D4 a1             :                0.5200
             D4 a2             :                5.0000
             D4 s6             :                1.0000
             D4 s8             :                2.7000
             D4 s9             :                5.0000
             alphaj            :                2.0000

  Z AO/shell   Hii/eV     exponent
  1     Wed Apr 25 08:07:45 CEST 2018   EN: 2.200 GM2: 0.406  GM3: 0.0800  RAES: 1.40
     1s    -10.707211    1.230000
  6     Wed Apr 25 08:07:45 CEST 2018   EN: 2.550 GM2: 0.538  GM3: 0.1500  RAES: 3.00
     2s    -13.970922    2.096432
     2p    -10.063292    1.800000
  7     Wed Apr 25 08:07:45 CEST 2018   EN: 3.040 GM2: 0.461  GM3:-0.0640  RAES: 1.90
     2s    -16.686243    2.339881
     2p    -12.523956    2.014332
  8     Wed Apr 25 08:07:45 CEST 2018   EN: 3.440 GM2: 0.452  GM3:-0.0517  RAES: 1.80
     2s    -20.229985    2.439742
     2p    -15.503117    2.137023
 16     Tue Apr 24 11:44:34 CEST 2018   EN: 2.580 GM2: 0.340  GM3:-0.0502  RAES: 3.10
     3s    -20.029654    1.981333
     3p    -11.377694    2.025643
     3d     -0.420282    1.702555

           ------------------------------------------------- 
          |        Self-Consistent Charge Iterations        |
           ------------------------------------------------- 

          ...................................................
          :                      SETUP                      :
          :.................................................:
          :  # basis functions                 224          :
          :  # atomic orbitals                 217          :
          :  # shells                          107          :
          :  # electrons                       208          :
          :  max. iterations                   250          :
          :  Hamiltonian                  GFN2-xTB          :
          :  restarted?                      false          :
          :  GBSA solvation                  false          :
          :  PC potential                    false          :
          :  electronic temp.          300.0000000     K    :
          :  accuracy                    1.0000000          :
          :  -> integral cutoff          0.2500000E+02      :
          :  -> integral neglect         0.1000000E-07      :
          :  -> SCF convergence          0.1000000E-05 Eh   :
          :  -> wf. convergence          0.1000000E-03 e    :
          :  Broyden damping             0.4000000          :
          ...................................................

 iter      E             dE          RMSdq      gap      omega  full diag
   1   -116.5303493 -0.116530E+03  0.534E+00    1.31       0.0  T
   2   -116.7289721 -0.198623E+00  0.329E+00    1.09       1.0  T
   3   -116.7527180 -0.237458E-01  0.187E+00    1.04       1.0  T
   4   -116.7944369 -0.417190E-01  0.774E-01    0.99       1.0  T
   5   -116.8167600 -0.223231E-01  0.325E-01    0.81       1.0  T
   6   -116.8204965 -0.373643E-02  0.162E-01    0.89       1.0  T
   7   -116.8210196 -0.523101E-03  0.514E-02    0.90       1.0  T
   8   -116.8210986 -0.790104E-04  0.218E-02    0.90       1.0  T
   9   -116.8211027 -0.408119E-05  0.120E-02    0.90       1.1  T
  10   -116.8211056 -0.288472E-05  0.621E-03    0.90       2.1  T
  11   -116.8211064 -0.857041E-06  0.238E-03    0.90       5.5  T
  12   -116.8211065 -0.108962E-06  0.107E-03    0.90      12.1  T
  13   -116.8211065 -0.172457E-07  0.560E-04    0.90      23.2  T
  14   -116.8211065 -0.453326E-09  0.351E-04    0.90      37.1  T

   *** convergence criteria satisfied after 14 iterations ***

         #    Occupation            Energy/Eh            Energy/eV
      -------------------------------------------------------------
         1        2.0000           -0.7732922             -21.0424
       ...           ...                  ...                  ...
        98        2.0000           -0.4125216             -11.2253
        99        2.0000           -0.4100257             -11.1574
       100        2.0000           -0.4013861             -10.9223
       101        2.0000           -0.3881424             -10.5619
       102        2.0000           -0.3776035             -10.2751
       103        2.0000           -0.3704452             -10.0803
       104        2.0000           -0.3691198             -10.0443 (HOMO)
       105                         -0.3362079              -9.1487 (LUMO)
       106                         -0.3202053              -8.7132
       107                         -0.3155753              -8.5872
       108                         -0.2851891              -7.7604
       109                         -0.2799247              -7.6171
       ...                                ...                  ...
       217                          0.6772907              18.4300
      -------------------------------------------------------------
                  HL-Gap            0.0329120 Eh            0.8956 eV
             Fermi-level           -0.3525586 Eh           -9.5936 eV

 SCC (total)                   0 d,  0 h,  0 min,  0.320 sec
 SCC setup                      ...        0 min,  0.001 sec (  0.385%)
 Dispersion                     ...        0 min,  0.002 sec (  0.592%)
 integral evaluation            ...        0 min,  0.104 sec ( 32.542%)
 zeroth order Hamiltonian       ...        0 min,  0.001 sec (  0.288%)
 iterations                     ...        0 min,  0.123 sec ( 38.496%)
 molecular gradient             ...        0 min,  0.087 sec ( 27.309%)
 printout                       ...        0 min,  0.001 sec (  0.368%)

         :::::::::::::::::::::::::::::::::::::::::::::::::::::
         ::                     SUMMARY                     ::
         :::::::::::::::::::::::::::::::::::::::::::::::::::::
         :: total energy            -115.561753804483 Eh    ::
         :: gradient norm              0.065301136587 Eh/a0 ::
         :: HOMO-LUMO gap              0.895579822741 eV    ::
         ::.................................................::
         :: SCC energy              -116.821106539876 Eh    ::
         :: -> isotropic ES            0.121340205716 Eh    ::
         :: -> anisotropic ES          0.005511173240 Eh    ::
         :: -> anisotropic XC          0.039200790373 Eh    ::
         :: -> dispersion             -0.089345478623 Eh    ::
         :: repulsion energy           1.260346782791 Eh    ::
         :: add. restraining           0.000000000000 Eh    ::
         :::::::::::::::::::::::::::::::::::::::::::::::::::::

           -------------------------------------------------
          |                Property Printout                |
           -------------------------------------------------

    * Orbital Energies and Occupations

         #    Occupation            Energy/Eh            Energy/eV
      -------------------------------------------------------------
         1        2.0000           -0.7732922             -21.0424
       ...           ...                  ...                  ...
        92        2.0000           -0.4284997             -11.6601
        93        2.0000           -0.4279409             -11.6449
        94        2.0000           -0.4210744             -11.4580
        95        2.0000           -0.4202765             -11.4363
        96        2.0000           -0.4148226             -11.2879
        97        2.0000           -0.4138759             -11.2621
        98        2.0000           -0.4125216             -11.2253
        99        2.0000           -0.4100257             -11.1574
       100        2.0000           -0.4013861             -10.9223
       101        2.0000           -0.3881424             -10.5619
       102        2.0000           -0.3776035             -10.2751
       103        2.0000           -0.3704452             -10.0803
       104        2.0000           -0.3691198             -10.0443 (HOMO)
       105                         -0.3362079              -9.1487 (LUMO)
       106                         -0.3202053              -8.7132
       107                         -0.3155753              -8.5872
       108                         -0.2851891              -7.7604
       109                         -0.2799247              -7.6171
       110                         -0.2612447              -7.1088
       111                         -0.2512235              -6.8361
       112                         -0.2416318              -6.5751
       113                         -0.2414129              -6.5692
       114                         -0.2398716              -6.5272
       115                         -0.2372711              -6.4565
       ...                                ...                  ...
       217                          0.6772907              18.4300
      -------------------------------------------------------------
                  HL-Gap            0.0329120 Eh            0.8956 eV
             Fermi-level           -0.3525586 Eh           -9.5936 eV

     #   Z        covCN         q      C6AA      α(0)
     1   6 C      2.970    -0.023    28.570     8.768
     2   6 C      2.868     0.114    25.480     8.274
     3   6 C      2.860     0.117    25.423     8.265
     4   6 C      2.972    -0.022    28.548     8.764
     5   6 C      3.317     0.064    24.585     7.900
     6   6 C      3.321     0.064    24.490     7.875
     7   7 N      1.860    -0.243    27.201     7.730
     8  16 S      2.640     0.351   127.566    19.009
     9   7 N      1.852    -0.252    27.413     7.760
    10   8 O      1.702    -0.293    18.864     5.864
    11   8 O      1.703    -0.285    18.725     5.842
    12   6 C      3.638     0.037    20.308     6.482
    13   6 C      3.644     0.040    20.245     6.468
    14   6 C      2.972     0.033    27.249     8.563
    15   6 C      2.977     0.026    27.424     8.590
    16  16 S      2.311     0.026   139.999    19.914
    17   6 C      2.976     0.025    27.435     8.592
    18   6 C      3.065    -0.041    28.940     8.821
    19   6 C      3.074    -0.044    29.022     8.833
    20   6 C      3.055    -0.045    29.071     8.842
    21   6 C      3.074    -0.043    28.992     8.828
    22   6 C      2.970     0.021    27.541     8.608
    23  16 S      2.281     0.078   137.899    19.764
    24   6 C      2.948    -0.023    28.589     8.770
    25   6 C      2.947    -0.007    28.198     8.709
    26   6 C      2.940    -0.020    28.501     8.756
    27   6 C      2.945    -0.008    28.213     8.712
    28   6 C      2.858     0.266    22.523     7.779
    29   7 N      2.859    -0.063    22.462     7.039
    30   6 C      2.888     0.147    24.809     8.166
    31  16 S      2.266    -0.049   143.087    20.133
    32  16 S      2.294    -0.046   142.951    20.123
    33   6 C      2.887     0.148    24.793     8.163
    34   7 N      2.865    -0.063    22.453     7.038
    35   6 C      2.859     0.266    22.518     7.778
    36   8 O      0.857    -0.390    21.475     6.213
    37   6 C      3.688    -0.044    21.563     6.646
    38  16 S      1.139    -0.292   151.764    20.831
    39  16 S      1.139    -0.295   151.906    20.841
    40   6 C      3.689    -0.045    21.572     6.647
    41   8 O      0.861    -0.385    21.373     6.198
    42   1 H      0.923     0.038     2.482     2.464
    43   1 H      0.923     0.059     2.207     2.323
    44   1 H      0.923     0.063     2.166     2.301
    45   1 H      0.924     0.065     2.146     2.291
    46   1 H      0.923     0.036     2.498     2.472
    47   1 H      0.923     0.054     2.267     2.355
    48   1 H      0.925     0.061     2.186     2.312
    49   1 H      0.925     0.071     2.075     2.253
    50   1 H      0.925     0.068     2.111     2.272
    51   1 H      0.924     0.047     2.352     2.398
    52   1 H      0.924     0.086     1.914     2.163
    53   1 H      0.924     0.068     2.105     2.269
    54   1 H      0.924     0.092     1.862     2.134
    55   1 H      0.923     0.075     2.029     2.227
    56   1 H      0.923     0.072     2.060     2.245
    57   1 H      0.924     0.078     2.004     2.214
    58   1 H      0.923     0.071     2.074     2.252
    59   1 H      0.924     0.091     1.872     2.139

 Mol. C6AA /au·bohr⁶  :      77921.635188
 Mol. C8AA /au·bohr⁸  :    2424698.284863
 Mol. α(0) /au        :        447.984260


Wiberg/Mayer (AO) data.
largest (>0.10) Wiberg bond orders for each atom
          total WBO             WBO to atom ...
     1  C   3.940        C    2 1.399    C    6 1.170    C   14 1.149
     2  C   3.925        C    1 1.399    C    3 1.237    O   10 1.032
     3  C   3.921        C    4 1.392    C    2 1.237    O   11 1.046
     4  C   3.940        C    3 1.392    C    5 1.170    C   15 1.150
     5  C   3.971        N    7 1.431    C    4 1.170    C    6 1.159
     6  C   3.971        N    9 1.430    C    1 1.170    C    5 1.159
     7  N   3.106        C    5 1.431    S    8 1.391    N    9 0.153
     8  S   3.107        N    7 1.391    N    9 1.387
     9  N   3.096        C    6 1.430    S    8 1.387    N    7 0.153
    10  O   2.130        C    2 1.032    C   13 0.950
    11  O   2.151        C    3 1.046    C   12 0.952
    12  C   3.928        H   42 0.981    H   44 0.980    H   43 0.976    O   11 0.952
    13  C   3.929        H   46 0.982    H   45 0.980    H   47 0.978    O   10 0.950
    14  C   3.923        C   19 1.431    S   16 1.165    C    1 1.149
    15  C   3.940        C   20 1.415    S   23 1.181    C    4 1.150
    16  S   2.633        C   14 1.165    C   17 1.136
    17  C   3.933        C   18 1.413    C   24 1.221    S   16 1.136
    18  C   3.960        C   17 1.413    C   19 1.391    H   48 0.953
    19  C   3.949        C   14 1.431    C   18 1.391    H   49 0.956
    20  C   3.952        C   15 1.415    C   21 1.413    H   50 0.957
    21  C   3.969        C   20 1.413    C   22 1.386    H   51 0.964
    22  C   3.936        C   21 1.386    C   26 1.232    S   23 1.149
    23  S   2.725        C   15 1.181    C   22 1.149
    24  C   3.938        C   25 1.587    C   17 1.221    H   52 0.947
    25  C   3.928        C   24 1.587    S   31 1.070    C   28 1.041
    26  C   3.940        C   27 1.577    C   22 1.232    H   53 0.952
    27  C   3.926        C   26 1.577    S   32 1.061    C   35 1.060
    28  C   3.942        O   36 1.700    N   29 1.087    C   25 1.041
    29  N   3.591        C   30 1.214    C   28 1.087    C   37 0.981    O   36 0.131    S   38 0.106
    30  C   3.946        S   38 1.584    N   29 1.214    S   31 1.074
    31  S   2.521        C   30 1.074    C   25 1.070    S   38 0.140
    32  S   2.507        C   33 1.093    C   27 1.061    S   39 0.146
    33  C   3.944        S   39 1.576    N   34 1.206    S   32 1.093
    34  N   3.591        C   33 1.206    C   35 1.093    C   40 0.982    O   41 0.129    S   39 0.105
    35  C   3.947        O   41 1.675    N   34 1.093    C   27 1.060
    36  O   2.040        C   28 1.700    N   29 0.131
    37  C   3.947        N   29 0.981    H   55 0.973    H   54 0.972    H   56 0.972
    38  S   1.919        C   30 1.584    S   31 0.140    N   29 0.106
    39  S   1.913        C   33 1.576    S   32 0.146    N   34 0.105
    40  C   3.948        N   34 0.982    H   57 0.974    H   59 0.972    H   58 0.971
    41  O   2.084        C   35 1.675    N   34 0.129
    42  H   0.997        C   12 0.981
    43  H   0.996        C   12 0.976
    44  H   0.995        C   12 0.980
    45  H   0.995        C   13 0.980
    46  H   0.998        C   13 0.982
    47  H   0.997        C   13 0.978
    48  H   0.996        C   18 0.953
    49  H   0.995        C   19 0.956
    50  H   0.995        C   20 0.957
    51  H   0.997        C   21 0.964
    52  H   0.992        C   24 0.947
    53  H   0.994        C   26 0.952
    54  H   0.991        C   37 0.972
    55  H   0.994        C   37 0.973
    56  H   0.994        C   37 0.972
    57  H   0.993        C   40 0.974
    58  H   0.994        C   40 0.971
    59  H   0.992        C   40 0.972

molecular dipole:
                 x           y           z       tot (Debye)
 q only:        1.161      -0.257       0.108
   full:        1.614      -0.228       0.035       4.145
molecular quadrupole (traceless):
                xx          xy          yy          xz          yz          zz
 q only:       46.622     -45.107     -86.991      -2.570      -6.231      40.369
  q+dip:       44.400     -49.173     -88.153      -0.829      -6.122      43.753
   full:       41.425     -48.419     -92.571       0.226      -6.129      51.146


           -------------------------------------------------
          | TOTAL ENERGY             -115.561753804483 Eh   |
          | GRADIENT NORM               0.065301136587 Eh/α |
          | HOMO-LUMO GAP               0.895579822741 eV   |
           -------------------------------------------------

------------------------------------------------------------------------
 * finished run on 2020/11/20 at 13:44:58.386     
------------------------------------------------------------------------
 total:
 * wall-time:     0 d,  0 h,  0 min,  0.446 sec
 *  cpu-time:     0 d,  0 h,  0 min,  0.438 sec
 * ratio c/w:     0.982 speedup
 SCF:
 * wall-time:     0 d,  0 h,  0 min,  0.320 sec
 *  cpu-time:     0 d,  0 h,  0 min,  0.320 sec
 * ratio c/w:     1.000 speedup

